Codigo;Nombre;Direccion_Fisica;Fk_Id_Municipio_Dep
10000;ACTIVO INTEGENERAL BURGOS;;2077
10008;CENTRO DE PROCESOS LITORAL-A;;
10010;GRUPO MULTIDISCIPLINARIO DE COORDINACION TECNICA;;
10101;GRUPO MULTIDISCIPLINARIO DE CONTROL INTERNO INSTITUCIONAL;;
10111;SUBGERENCIA DE EVALUACION DEL PROCESO FINANCIERO;;
10112;SUBGERENCIA DE EVALUACION DE TRANSFORMACION FINANCIERA;;
10120;SUBGERENCIA DE ADMINISTRACION DE SEGURIDAD EN LOS PROCESOS ;;
10122;SUBGERENCIA DE CONTROL E INTEGRACION GENERAL DE NEGOCIOS DE EMPRESAS FILIALES Y ATENCION A REQUERIMIENTOS;;
10140;SUBGERENCIA REGIONAL DE SSSTPA NORTE;;
10150;SUBGERENCIA DE SEGURIDAD SALUD EN EL TRABAJO Y PROTECCION AMBIENTAL MARITIMA RSSSTPA;;
10200;GERENCIA DE REGISTRO MEDICION CALIBRACION BALANCE Y DESARROLLO COMERCIAL;;
10210;SUBGERENCIA DE MEDICION;;
10500;GRUPO MULTIDISCIPLINARIO OPERADOR DE POZOS E INSTALACION Y EXPLORACION;;
10600;GRUPO MULTIDISCIPLINARIO MANTENIMIENTO EQUIPO DINAMICO SISTEMAS AUXIARES;;
11000;COORDINACION DE SEGURIDAD INDUSTRIAL Y PROTECCION AMBIENTAL SIPA EN PROCESOS DEL ACTIVO BELLOTA JUJO;;1973
11000;COORDINACION DE SEGURIDAD INDUSTRIAL Y PROTECCION AMBIENTAL SIPA EN PROCESOS DEL ACTIVO CINCO PRESIDENTES;;2095
11000;GERENCIA DE SEGURIDAD INDUSTRIAL Y PROTECCION AMBIENTAL REGION SUR;;
11000;SUBGERENCIA DE SEGURIDAD INDUSTRIAL PROTECCION AMBIENTAL Y CALIDAD;;
11001;SEGURIDAD INDUSTRIAL Y PROTECCION AMBIENTAL SIPA ;;2048
11001;COORDINACION DE INTEGRIDAD Y CONFIGURACION DE ACTIVOS;;
11101;GRUPO MULTIDISCIPLINARIO DE EVALUACION DE AREAS CIUDAD DEL CARMEN;;216
11200;SEGURIDAD INDUSTRIAL Y PROTECCION AMBIENTAL SIPA EN LOS PROCESOS DE PRODUCCION Y TRANSPORTE DE HIDROCARBUROS;;
11200;SUBGERENCIA DE PROTECCION AMBIENTAL;;
11210;SUBGERENCIA DE PROGRAMACION Y ENLACE OPERATIVO;;
11230;SUBGERENCIA DE OPERACIONES BURGOS;;2077
11230;GRUPO MULTIDISCIPLINARIO DE SEGURIDAD INDUSTRIAL Y PROTECCION AMBIENTAL SIPA;;
11240;DEPARTAMENTO DE OPERACIONES;;2225
11300;SUBGERENCIA DE AUDITORIAS Y SEGUIMIENTO;;
11301;GRUPO MULTIDISCIPLINARIO DE CARACTERIZACION DE YACIMIENTOS Y EXPLORACION DE CAMPOS;;
11320;DEPARTAMENTO DE VIGILANCIA Y CONTROL DE ACCESOS;;
11330;SUBGERENCIA DE OPERADOR GAS TERRESTRE SUR;;
11401;DEPARTAMENTO DE INSPECCION TECNICA Y SEGURIDAD INDUSTRIAL;;
11403;DEPARTAMENTO DE CONTRAINCENDIO;;
11410;SUBGERENCIA DE INTEGRIDAD Y CONFIGURACION GAS MARINO;;
11420;SUBGERENCIA DE OPERACIONES DE GAS MARINO;;1980
11420;SUBGERENCIA DE OPERACIONES DE GAS MARINO;;
11421;DEPARTAMENTO DE PROGRAMACION DE PAROS DE PLANTA;;
11422;DEPARTAMENTO DE INGENIERIA DE CONFIGURACION Y MANTENIMIENTO ;;
11423;DEPARTAMENTO DE GESTION DEL MANTENIMIENTO;;
11426;TRATAMIENTO DE AGUA;;
11431;DEPARTAMENTO DE EVALUACION OPERATIVA Y SISTEMAS DE GESTION;;
11433;DEPARTAMENTO DE ASEGURIDAD DE LA CALIDAD DEL PRODUCCION;;
11434;PLANTA DE DESTILACION ATMOSFERICA Y AL VACIO;;
11436;PLANTA COQUIZADORA;;
11437;PLANTA DE ALQUILACION;;
11438;PLANTA DE DESINTEGRACION CATALITICA;;
11442;PLANTA HIDROTRATADORA DE GASOLEOS TREN 1;;
11444;PLANTA DE HIDROGENO TREN 1;;
11446;PLANTA HIDROTRATADORA DE NAFTAS TREN 1;;
11448;BOMBEOS Y ALMACENAMIENTO;;
11448;PLANTA REFORMADORA DE NAFTAS TREN 1;;
11450;PLANTA ISOMERIZADORA DE PENTANOS Y HEXANOS;;
11451;PLANTA DE TRATAMIENTO Y RECUPERACION GASES;;
11455;PLANTA DE REGENERACION DE AMINAS;;
11458;TRATAMIENTO DE EFLUENTES;;
11460;PLANTA DE COGENERACION;;
11461;PLANTA DE SUMINISTRO Y TRATAMIENTO DE AGUA;;
11462;MANTENIMIENTO DE INSTRUMENTOS;;
11468;LABORATORIO QUIMICO;;
11512;DEPARTAMENTO DEFUERZA Y SERVICIO PRINCIPALES;;
11550;"PLANTA DE HIDROGENO U801""""";;
11572;PLANTA DESULFURADORA DE GASOLINA CATALITICA ULSG;;
11602;DEPARTAMENTO DE PLANEACION GESTION Y SUPERVISION DE EQUIPO ;;
11631;DEPARTAMENTO EVALUACION OPERATIVA Y SISTEMAS DE GESTION;;
11801;GRUPO MULTIDISCIPLINARIO DE PROYECTOS EXPLORATORIOS;;
11832;DEPARTAMENTO DE OPTIMIZACION DE PROCESOS;;
11910;SUBGERENCIA DE ADMINISTRACION DE LA PRODUCCION;;
11933;DEPARTAMENTO DE SEGURIDAD DE LA CALIDAD DEL PRODUCCION;;
11948;PLANTA FRACCIONADORA Y DE RECUPERACION DE LIGEROS HDR;;
12120;SUBGERENCIA DE CONTROL DE PROCESOS DE GAS Y PETROQUIMICA B;;
12140;SUBGERENCIA DE MOVILIDAD DE PRODUCCION Y SISTEMAS DE MEDICION;;
12230;SUBGERENCIATECNICO DE SOP Y NORMALIZACION OPERATIVA;;
12261;SECTOR DE DUCTOS VALLE DE MEXICO;;229
12261;SECTOR DE DUCTOS;;432
12271;SECTOR DE DUCTOS;;1970
12301;GRUPO MULIDISCIPLINARIO OPERATIVA CONT Y ASOC PRODUCCION ;;2077
12310;SUBGERENCIA DE CONFIABILIDAD OPERATIVA;;
12320;SUBGERENCIA DE INGENIERIA Y CONTROL;;
12330;SUBGERENCIA DE MANTENIMIENTO;;
12340;SUBGERENCIA DE DIAGNOSTICO Y REPARACIONES;;
12350;SUBGERENCIA DE INSPECCION TECNICA;;
12413;DEPARTAMENTO DE RECUPERACION DE LICUABLES;;
12422;DEPARTAMENTO DE INGENIERIA DE CONFIABILIDAD;;
12514;DEPARTAMENTO DE BALANCE Y ENLACE COMERCIAL;;
12521;DEPARTAMENTO GESTION DEL MANTENIMIENTO Y PAROS DE PLANTA;;
12532;DEPARTAMENTO DE ASEGURAMIENTO DE LA CALIDAD DEL PRODUCTO;;
12555;ESTACION COMPRESION DE GAS REGENERACION;;
12612;DEPARTAMENTO DE ENDULZAMIENTO DE GAS Y RECUPERACION DE AZUFRE;;
12700;GERENCIA DE COMPLEJO PROCESADOR DE GAS BURGOS;;2077
12814;DEPARTAMENTO DE ISOMERIZACION MOVILIDAD PRODUCCION E INTEGRACION ;;
12911;DEPARTAMENTO DE PRODUCCION Y SERVICIOS PRINCIPALES;;
12923;DEPARTAMENTO DE INGENIERIA DE PROCESOS Y MEJORA OPERATIVA;;
13201;GRUPO MULTIDISCIPLINARIO DE MANTENIMIENTO CONFIGURACION Y CONSTRUCCION;;
13210;SUBGERENCIA DE INICIACION ESTUDIOS Y SOPORTE A LA PRODUCCION;;
13301;GRUPO MULTIDISCIPLINARIO DE PROGRAMACION Y EVALUACION OPERATIVA;;
13320;DEPARTAMENTO TECNICA DE SOPORTE Y NORMAS DEL OPERADOR;;
13320;SUBGERENCIA DE CONFIABILIDAD DE PROCESOS;;
13401;GRUPO MULTIDISCIPLINARIO DE CARTERA DE PROYECTOS Y PROGRAMACION;;
13402;GRUPO MULTIDISCIPLINARIO DE ADMINISTRACION DE YACIMIENTOS;;
13403;GRUPO MULTIDISCIPLINARIO DE INTERVENCIONES A POZOS;;
13404;GRUPO MULTIDISCIPLINARIO DE OPERACION DE POZOS E INSTALACIONES;;
13410;SUBGERENCIA DE PRODUCCION;;
13415;PLANTA DE OXIDO DE ETILENO Y GLICOLES;;
13420;DEPARTAMENTO DE SERVICIOS AUXILIARES;;
13530;DEPARTAMENTO SERVICIO TECNICO CENTROL QUIMICO Y BALANCE;;
13541;DEPARTAMENTO MANTENIMIENTO PLANEACION PROGRAMACION Y PARO SPTA;;
13603;DEPARTAMENTO DE PLANTAS DE AMONIACO;;
13700;COMPLEJO PETROQUIMICO INDEPENDENCIA;;
13713;DEPARTAMENTO DE SERVICIO PRINCIPALES Y TRATAMIENTO DE AGUA;;
13720;SUBGERENCIA DE CONFIABILIDAD Y MANTENIMIENTO ;;
13721;DEPARTAMENTO DE GESTION DEL MANTENIMIENTO Y PAROS DE PLANTA;;
13730;TERMINAL DE GAS LICUADO A CACTUS;;172
13730;TERMINAL DE GAS LICUADO A;;407
13730;TERMINAL DE GAS LICUADO A;;527
14101;GRUPO MULTIDISCIPLINARIO DE COORDINACION OPERATIVA;;
14210;SUBGERENCIA DE EVALUACION OPERATIVA;;
15201;GRUPO MULTIDISCIPLINARIO DE MANTENIMIENTO CONFIABILIDAD Y CONSTRUCCION;;1974
15218;SUBGERENCIA DE INTEGRACION GENERAL DE MERCADOTECNIA PRODUCCION Y COMBUSTIBLES INDUSTRIALES;;
15271;SUBGERENCIA DE VENTAS DE POLIMEROS;;
15272;SUBGERENCIA DE VENTAS DE PETROQUIMICOS;;
15405;GRUPO MULTIDISCIPLINARIO DE MANTENIMIENTO;;1980
15602;GRUPO MULTIDISCIPLINARIO DE ADMINISTRACION DE YACIMIENTOS;;1970
15605;GRUPO MULTIDISCIPLINARIO DE MANTENIMIENTO;;
16000;COORDINACION DE CONSTRUCCION Y MANTENIMIENTO SECTOR OPERATIVO;;1980
16000;COORDINACION DE CONSTRUCCION Y MANTENIMIENTO SECTOR OPERATIVO;;2095
16000;OFICINA SUBDIRECCION DE PRODUCCION REGION NORTE;;2288
16001;CONTROL Y EVALUACION DE AREA;;2225
16002;CONSTRUCION Y MANTENIMIENTO DE AREA;;2048
16100;LOGISTICA;;
16301;GRUPO MULTIDISCIPLINARIO DE PROGRAMACION Y EVALUACION OPERATIVA;;2288
17000;SUBDIRECCION DE MANTENIMIENTO Y LOGISTICA;;
17101;GRUPO MULIDISCIPLINARIO DE PROGRAMACION Y EVALUACION CIUDAD DEL CARMEN;;216
17110;SUBGERENCIA DE CONTROL COSTA AFUERA Y SERVICIOS ESPECIALIZADOS;;
17140;SUBGERENCIA DE ALIMENTACION Y HOSPEDAJE;;
17201;GRUPO MULTIDISCIPLINARIO CSM Y MANTENIMIENTO CONFIABILIDAD Y CONSTRUCCION DE INFRAESTRUCTURA;;
17211;GRUPO MULTIDISCIPLINARIO DE SERVICIOS DE SOPORTE Y LOGISTICA REGION MARINA;;
17220;SUBGERENCIA DE MANTENIMIENTO CANTARELL NORTE Y SUR;;
17230;SUBGERENCIA DE MANTENIMIENTO CANTARELL CENT KUMAZA;;
17240;SUBGERENCIA DE MANTENIMIENTO ABKATUN POL CH;;
17300;GERENCIA DE INGENIERIA Y CONSTRUCCION;;
17311;GRUPO MULTIDISCIPLINARIO DE SERVICIO DE SOPORTE Y LOGISTICA TERRESTRE;;
17720;SUBGERENCIA DE CALIDAD;;
17820;SUBGERENCIA GESTION Y ATENCION A ORGANOS FISCALES;;
18110;SUBGERENCIA DE AUDITORIA EVALUACION Y SOPORTE A PROYECTOS;;
18120;SUBGERENCIA SEGURIDAD EN EL TRABAJO E INVESTIGACION Y ANALISIS INCIDENTES Y ACCIDENTES;;
18130;SUBGERENCIA DE PROTECCION AMBIENTAL Y DESARROLLO SUSTENTABLE;;
18140;SUBGERENCIA DE NORMAS PLANEACION Y EJERCICIO DEL SISTEMA DE SEGURIDAD Y PROTECCION AMBIENTAL SSPA;;
18150;SUBGERENCIA DE SEGURIDAD DE PROCESOS ADMINISTRACION DE RIESGOS Y RESPUESTA A EMERGENCIAS;;
18201;GRUPO MULTIDISCIPLINARIO DE MEDICION Y BALANCES DOS BOCAS;;1982
18210;SUBGERENCIA DEL SISTEMA SSPA Y PROTECCION AMBIENTAL;;
18220;SUBGERENCIA SEGURIDAD PROCESOS Y SALUD EN EL TRABAJO;;
18221;DEPARTAMENTO DE SSSTPA;;960
18221;DEPARTAMENTO DE SSSTPA;;2054
18221;DEPARTAMENTO DE SSSTPA BURGOS;;2077
18301;GERENCIA DE COMERCIALIZACION DE HIDROCARBUROS;;
18301;GRUPO MULTIDISCIPLINARIO DE COMERCIALIZACION DE HIDROCARBUROS;;
18310;SUBGERENCIA DEL SISTEMA SSPA;;
18330;SUBGERENCIA DE SEGURIDAD DE PROCESOS;;
18340;SUBGERENCIA DE SALUD EN EL TRABAJO;;
18341;DEPARTAMENTO DE SSSTPA CACTUS;;172
18341;DEPARTAMENTO DE SSSTPA;;1085
18341;DEPARTAMENTO DE SSSTPA NUEVO PEMEX;;1972
18341;DEPARTAMENTO DE SSSTPA LA VENTA;;1976
18341;DEPARTAMENTO DE SSSTPA CIUDAD PEMEX;;1980
18341;AREA DE SEGURIDAD PAJARITOS;;2138
18420;SUBGERENCIA DE SEGURIDAD DE PROCESOS Y SALUD EN EL TRABAJO;;
18421;DEPARTAMENTO DE SSSTPA INDEPENDENCIA;;
18422;COORDINACION DE PREVENCION Y CONTRAINCENDIO;;
19101;GRUPO MULTIDISCIPLINARIO DE PLANES DE EXPLOTACION CIUDAD DEL CARMEN;;216
19301;GRUPO MULTIDISCIPLINARIO DE INGENIERIA DE INTERVENCIONES A POZOS DE EXPLORACION;;
19401;GRUPO MULTIDISCIPLINARIO DE INGENIERIA DE INTERVENCIONES A POZOS DE EXPLOTACION;;2083
19501;GRUPO MULTIDISCIPLINARIO DE RECURSOS TECNICOS ESPECIALIZADOS;;
19701;GRUPO MULTIDISCIPLINARIO DE ASEGURAMIENTO TECNICO DE EXPLORACION;;
19901;GRUPO MULTIDISCIPLINARIO CERT RESER DE HIDROCARBUROS CIUDAD DEL CARMEN;;216
20000;OFICINA DEL JEFE SUPERINTENDENTE GENERAL DEL COMPLEJO PROCESADOR DE GAS Y PETROQUIMICA LA VENTA;;1976
20010;DEPARTAMENTO DE SEGURIDAD FISICA;;
20101;GRUPO MULTIDISCIPLINARIO DE INTEGRACION Y OPTIMIZACION DEL PORTAFOLIO EXPLORACION Y PRODUCCION;;
20112;PLANTA FRACCIONADORA DE HIDROCARBUROS;;
20115;PLANTA CRIOGENICA;;
20151;MOVIMIENTO DE PRODUCTOS;;
20251;OFICINA PARA LA GESTION DE LA LICENCIA SOCIAL DE OPERACION VILLAHERMOSA;;1972
20261;DEPARTAMENTO GENERAL DE DERECHOS PETROLEROS UNIDAD Y OCUPACION SUPERFICIAL;;
20301;GRUPO MULTIDISCIPLINARIO DE SEGURIDAD Y MEJORA CONTINUA DE COSTOS;;
20401;GRUPO MULTIDISCIPLINARIO DE CUMPLIMIENTO REGULATORIO DE EXPLORACION Y PRODUCCION;;
21000;TERMINAL DE ALMACENAMIENTO Y REPARTO;;268
21000;TERMINAL DE ALMACENAMIENTO Y REPARTO;;527
21000;TERMINAL DE ALMACENAMIENTO Y REPARTO;;764
21000;TERMINAL DE ALMACENAMIENTO Y REPARTO;;770
21000;TERMINAL DE ALMACENAMIENTO Y REPARTO;;960
21000;TERMINAL DE ALMACENAMIENTO Y REPARTO;;1690
21000;TERMINAL DE ALMACENAMIENTO Y REPARTO;;1852
21000;SUBDIRECCION DE SEGURIDAD SALUD EN EL TRABAJO Y PROTECCION AMBIENTAL;;
21020;UNIDAD DE MOVIMIENTO DE PRODUCTOS;;
21101;GRUPO MULTIDISCIPLINARIO DEL SPSSPA E INTEGRACION DE PROYECTOS;;
21110;INGENIERIA DE OPERACION;;
21110;PLANTA DE AMONIACO PROPANO;;
21122;SUBGERENCIA DE ADMINISTRACION Y ANALISIS FINANCIERO DE ALMACENES Y BIENES DE CONSUMO;;
21131;LABORATORIO;;
21200;GERENCIA EVALUACION AUDITORIA Y NORMATIVIDAD;;
21201;GRUPO MULTIDISCIPLINARIO DE EVALUACION AUDITORIA Y NORMATIVIDAD;;
21210;AREA DE OPERACION;;1
21210;AREA DE OPERACION;;35
21210;AREA DE OPERACION BARRANCA DEL MUERTO;;223
21210;AREA DE OPERACION AÑIL;;230
21210;AREA DE OPERACION 18 DE MARZO;;233
21210;AREA DE OPERACION;;363
21210;AREA DE OPERACION;;424
21210;AREA DE OPERACION;;527
21210;AREA DE OPERACION EL CASTILLO;;571
21210;AREA DE OPERACION;;656
21210;AREA DE OPERACION SAN JUAN IXHUATEPEC;;880
21210;AREA DE OPERACION;;882
21210;AREA DE OPERACION;;1000
21210;AREA DE OPERACION;;1690
21210;AREA DE OPERACION;;1816
21210;AREA DE OPERACION PAJARITOS;;2138
21210;AREA DE OPERACION;;2288
21211;TALLER DE MECANICA DE PISO;;
21220;AREA DE MANTENIMIENTO;;424
21220;AREA DE MANTENIMIENTO EL CASTILLO;;571
21220;AREA DE MANTENIMIENTO PAJARITOS;;2138
21220;SUBGERENCIA DE VINCULACION CON PROVEEDORES Y CONTRATISTAS;;2288
21224;TALLER DE PAILERIA Y SOLDADURA;;
21242;TALLER DE PINTURA;;
21243;TALLER DE ALBAÑILERIA Y ASBESTOS;;
21300;AREA DE SEGURIDAD INDUSTRIAL Y PROTECCION AMBIENTAL EL CASTILLO;;571
21300;AREA DE SEGURIDAD INDUSTRIAL Y PROTECCION AMBIENTAL;;656
21300;AREA DE SEGURIDAD INDUSTRIAL Y PROTECCION AMBIENTAL;;1690
21300;AREA DE SEGURIDAD INDUSTRIAL Y PROTECCION AMBIENTAL;;2288
21300;DEPARTAMENTO DE QUIMICA;;
21301;GRUPO MULTIDISCIPLINARIO DE SSTPA REGION NORTE;;2077
21310;PLANTA DE GENERACION ELECTRICA;;
21320;PLANTA DE GENERACION DE VAPOR;;
21401;GRUPO MULTIDISCIPLINARIO SSTPA REGION SUR;;172
21401;GRUPO MULTIDISCIPLINARIO SSTPA REGION SUR;;1973
21401;GRUPO MULTIDISCIPLINARIO SSTPA REGION SUR;;1974
21401;GRUPO MULTIDISCIPLINARIO SSTPA REGION SUR;;
21410;TALLER DE INSTRUMENTOS;;
21501;GRUPO MULTIDISCIPLINARIO SSTPA REGION MARINA PARAISO 27;;1982
21501;GRUPO MULTIDISCIPLINARIO SSTPA REGION MARINA;;
21501;SUBGERENCIA DE ANALISIS Y OPTIMIZACION;;
21504;SUBGERENCIA DE INTEGRACION DE SOLUCIONES;;
21510;SERVICIOS A POZOS;;
21520;OFICINA DE SERVICIOS ASISTENCIALES Y BENEFICIOS CONTRACTUALES DE PEMEX EXPLORACION Y PRODUCCION;;2123
21520;SERVICIOS AUXILIARES CONTROL DISTRIBUIDO;;
21601;GRUPO MULTIDISCIPLINARIO SSTPA DE PERFORACION;;172
21601;GRUPO MULTIDISCIPLINARIO SSTPA DE PERFORACION CIUDAD DEL CARMEN;;216
21601;GRUPO MULTIDISCIPLINARIO SSTPA DE PERFORACION;;1982
21601;GRUPO MULTIDISCIPLINARIO SSTPA DE PERFORACION;;2077
21601;GRUPO MULTIDISCIPLINARIO SSTPA DE PERFORACION;;2114
21601;GRUPO MULTIDISCIPLINARIO SSTPA DE PERFORACION;;2123
21601;GRUPO MULTIDISCIPLINARIO SSTPA DE PERFORACION;;2225
21601;GRUPO MULTIDISCIPLINARIO SSTPA DE PERFORACION;;
21700;DISEÑO E INGENIERIA DE POZOS;;
21800;SUBGERENCIA PROGRAMACION EVALUACION Y SOPORTE OPTIMO;;
21810;OPERACION DE PERFORACION DE POZOS;;
21820;OPERACION DE TERMINACION Y REPARACION DE POZOS;;
21840;MANTENIMIENTO A EQUIPOS;;
21850;SERVICIOS DE APOYO OPERATIVO;;
21900;SUBGERENCIA DE SERVICIO A POZOS;;
22000;DEPARTAMENTO DE MANTENIMIENTO;;
22001;ATENCION A LA COMUNIDAD DISTRITO;;1970
22100;SEGURIDAD INDUSTRIAL Y PROTECCION AMBIENTAL SIPA SECTOR OPERATIVO;;172
22100;SEGURIDAD INDUSTRIAL Y PROTECCION AMBIENTAL SIPA SECTOR OPERATIVO;;2048
22100;SEGURIDAD INDUSTRIAL Y PROTECCION AMBIENTAL SIPA SECTOR OPERATIVO BURGOS;;2077
22100;SEGURIDAD INDUSTRIAL Y PROTECCION AMBIENTAL SIPA SECTOR OPERATIVO CINCO PRESIDENTES;;2095
22100;DEPARTAMENTO DE MANTENIMIENTO MECANICO;;
22100;GERENCIA DE SEGURIDAD INDUSTRIAL Y PROTECCION AMBIENTAL SIPA;;
22100;SEGURIDAD INDUSTRIAL Y PROTECCION AMBIENTAL;;
22102;UNIDAD DE NORMATIVIDAD LABORAL;;
22104;UNIDAD DE CONCERTACION LABORAL;;
22107;DEPARTAMENTO DE PRESTACIONES CULTURALES Y DEPORTIVAS;;
22108;DEPARTAMENTO DE GESTION REGIONAL;;
22120;DEPARTAMENTO DE MANTENIMIENTO A PLANTAS;;
22120;TALLER DE COMBUSTION INTERNA;;
22141;OFICINA DE ADMINISTRACION DE LA OPERACION REGION NORTE;;
22143;DEPARTAMENTO DE PERSONAL;;992
22146;CENTRO DE SERVICIOS AL PERSONAL;;2235
22156;GRUPO MULTIDISCIPLINARIO DE RECLUTAMIENTO Y DESARROLLO HUMANO;;
22167;CENTRO DE DESARROLLO INFANTIL CENDI OFICINA DE LACTANTES;;
22179;DEPARTAMENTO DE OPERACIONES;;2201
22190;DEPARTAMENTO DE CENTRO DE DESARROLLO INFANTIL CENDI;;
22191;CENTRO DE DESARROLLO INFANTIL CENDI CIUDAD DEL CARMEN;;216
22191;CENTRO DE DESARROLLO INFANTIL CENDI;;224
22191;CENTRO DE DESARROLLO INFANTIL CENDI;;527
22191;CENTRO DE DESARROLLO INFANTIL CENDI;;1085
22191;CENTRO DE DESARROLLO INFANTIL CENDI VILLAHERMOSA;;1972
22191;CENTRO DE DESARROLLO INFANTIL CENDI CIUDAD PEMEX;;1980
22191;CENTRO DE DESARROLLO INFANTIL CENDI;;2054
22191;CENTRO DE DESARROLLO INFANTIL CENDI;;2077
22191;CENTRO DE DESARROLLO INFANTIL CENDI;;2201
22192;DEPARTAMENTO DE INTEGRACION OFICINA CENTRALES;;
22194;CENTRO DE DESARROLLO INFANTIL CENDI;;432
22194;CENTRO DE DESARROLLO INFANTIL CENDI OFICINAS DE PREESCOLAR I;;
22194;REPRESENTACION DE INCLUSION NORTE;;
22194;REPRESENTACION INCLUSION ALTIPLANO;;
22196;AREA DE DESARROLLO HUMANO;;32
22196;AREA DE DESARROLLO HUMANO;;960
22197;AREA DE DESARROLLO HUMANO;;992
22199;AREA DE DESARROLLO HUMANO;;2225
22224;SUBGERENCIA DE OPERACION Y MEJORA DE SERVICIOS AL PERSONAL;;
22300;DEPARTAMENTO DE MANTENIMIENTO ELECTRICO;;
22310;TALLER DE ELECTRICIDAD;;
22311;SUBGERENCIA DE ORGANIZACION DE PROCESOS DE SOPORTE;;
22321;GRUPO MULTIDISCIPLINARIO DE SERVICIOS;;1816
22322;SUBGERENCIA CAPACITACION Y DESARROLLO PROCESOS EXPLORACION Y PRODUCCION;;
22323;SUBGERENCIA DE CAPACITACION Y DESARROLLO DE PROCESOS DE TRANSFORMACION INDUSTRIAL Y FERTILIZANTES;;
22324;SUBGERENCIA CAPACITACION Y DESARROLLO PROCESOS DE LOGISTICA;;
22325;SUBGERENCIA DE CAPACITACION Y DESARROLLO PROCESOS SOPORTE;;
22326;SUBGERENCIA DE LA UNIDAD EMPRESARIAL DE PEMEX CERTIFICACION Y COMPETITIVIDAD;;
22327;SUBGERENCIA DE DESEMPEÑO Y CULTURA;;
22331;CENTRO DE ATENCION DE BIEN LABORAL Y DE GENERO;;
22332;SUBGERENCIA DE PROGRAMAS SOCIOCULTURALES;;
22333;SUBGERENCIA DE INCLUSION LABORAL Y SOCIAL;;
22401;GRUPO MULTIDISCIPLINARIO DE CARACTERIZACION Y EVALUACION DINAMICA DE CAMPOS ESTRATEGICOS;;
22410;TALLER DE CARPINTERIA;;
22500;DEPARTAMENTO DE CONTRATOS;;
22501;GRUPO MULTIDISCIPLINARIO DE EJERCICIO Y SEGURIDAD DE POZOS DE DESARROLLO;;
23001;GRUPO MULTIDISCIPLINARIO DE PROYECTOS DE OPTIMIZACION;;172
23001;GRUPO MULTIDISCIPLINARIO DE PROYECTOS DE OPTIMIZACION;;1973
23001;GRUPO MULTIDISCIPLINARIO DE PROYECTOS DE OPTIMIZACION;;1982
23001;GRUPO MULTIDISCIPLINARIO DE PROYECTOS DE OPTIMIZACION;;2048
23001;GRUPO MULTIDISCIPLINARIO DE PROYECTOS DE OPTIMIZACION;;2114
23001;GRUPO MULTIDISCIPLINARIO DE PROYECTOS DE OPTIMIZACION;;2123
23001;GRUPO MULTIDISCIPLINARIO DE PROYECTOS DE OPTIMIZACION;;2225
23101;HOSPITAL GENERAL CIUDAD DEL CARMEN;;216
23101;HOSPITAL CENTRAL NORTE;;224
23101;HOSPITAL CENTRAL SUR DE ALTA ESPECIALIDAD PICACHO;;236
23101;HOSPITAL REGIONAL;;432
23101;HOSPITAL GENERAL;;527
23101;HOSPITAL GENERAL;;616
23101;HOSPITAL GENERAL;;960
23101;HOSPITAL GENERAL;;992
23101;HOSPITAL GENERAL;;1085
23101;HOSPITAL GENERAL;;1973
23101;HOSPITAL GENERAL CIUDAD PEMEX;;1980
23101;HOSPITAL GENERAL DOS BOCAS;;1982
23101;HOSPITAL REGIONAL;;2077
23101;HOSPITAL GENERAL;;2138
23101;HOSPITAL REGIONAL;;2201
23101;HOSPITAL GENERAL;;2208
23101;HOSPITAL REGIONAL;;2225
23101;HOSPITAL GENERAL;;2288
23101;HOSPITAL REGIONAL;;
23101;UNIDAD MEDICA DEL CENTRO ADMINISTRATIVO;;
23102;CLINICA DE PRIMER NIVEL VILLAHERMOSA;;1972
23102;HOSPITAL GENERAL;;2123
23102;CLINICA;;2201
23201;GRUPO MULTIDISCIPLINARIO DE OPERACION Y MANTENIMIENTO A EQUIPO;;172
23201;GRUPO MULTIDISCIPLINARIO DE OPERACION Y MANTENIMIENTO A EQUIPO CIUDAD DEL CARMEN;;216
23201;GRUPO MULTIDISCIPLINARIO DE OPERACION Y MANTENIMIENTO A EQUIPO;;1973
23201;GRUPO MULTIDISCIPLINARIO DE OPERACION Y MANTENIMIENTO A EQUIPO;;1982
23201;GRUPO MULTIDISCIPLINARIO DE OPERACION Y MANTENIMIENTO A EQUIPO;;2077
23201;GRUPO MULTIDISCIPLINARIO DE OPERACION Y MANTENIMIENTO A EQUIPO;;2225
23210;SUBGERENCIA DE MEDICINA PREVENTIVA Y PROMOCION DE LA SALUD;;
23220;SUBGERENCIA DE SEGURIDAD SALUD EN EL TRABAJO Y PROTECCION AMBIENTAL SSTPA;;
23301;GRUPO MULTIDISCIPLINARIO PERFORACION Y REPARACION POZOS;;2048
23301;GRUPO MULTIDISCIPLINARIO DE PERFORACION Y REPARACION DE POZOS;;2077
23301;GRUPO MULTIDISCIPLINARIO DE PERFORACION Y REPARACION DE POZOS;;2114
23330;SUBGERENCIA DE NORMAS Y RECURSOS TECNICOS;;
23401;GRUPO MULTIDISCIPLINARIO DE PERFORACION Y REPARACION DE POZOS;;172
23401;GRUPO MULTIDISCIPLINARIO DE PERFORACION Y REPARACION DE POZOS;;1970
23401;GRUPO MULTIDISCIPLINARIO DE PERFORACION Y REPARACION DE POZOS;;1973
23421;TRIPULACION OPERATIVA Y DE MANTENIMIENTO A EQUIPO;;1973
23501;GRUPO MULTIDISCIPLINARIO DE PERFORACION Y REPARACION DE POZOS;;1982
23503;TRIPULACION OPERATIVA Y DE MANTENIMIENTO A EQUIPO CIUDAD DEL CARMEN;;216
23601;GRUPO MULTIDISCIPLINARIO DE SERVICIOS A POZOS;;172
23601;GRUPO MULTIDISCIPLINARIO DE SERVICIOS A POZOS CIUDAD DEL CARMEN;;216
23601;GRUPO MULTIDISCIPLINARIO DE SERVICIOS A POZOS;;1973
23601;GRUPO MULTIDISCIPLINARIO DE SERVICIOS A POZOS;;1980
23601;GRUPO MULTIDISCIPLINARIO DE SERVICIOS A POZOS;;2048
23601;GRUPO MULTIDISCIPLINARIO DE SERVICIOS A POZOS;;2077
23601;GRUPO MULTIDISCIPLINARIO DE SERVICIOS A POZOS;;2114
23601;GRUPO MULTIDISCIPLINARIO DE SERVICIOS A POZOS;;2225
23601;GRUPO MULTIDISCIPLINARIO DE SERVICIOS A POZOS;;
23610;GERENCIA DE CONTROL DE LOS PROCESOS DE LA REFINERIA;;432
23610;GERENCIA DE CONTROL DE LOS PROCESOS DE LA REFINERIA;;960
23684;TRIPULACION OPERATIVA Y DE MANTENIMIENTO A EQUIPO;;2225
23710;GERENCIA DE CONTROL DE PROCESOS GAS Y PROBANO BUTANO;;992
23910;GERENCIA DE CONTROL DE PROCESOS Y SOPORTE A SERVICIOS DE SALUD;;
24010;UNIDAD DE COORDINACION TECNICA;;
24110;TALLER DE TUBERIA;;
24112;DEPARTAMENTO DE SISTEMAS DE SEGURIDAD;;
24120;TALLER DE PAILERIA;;
24121;DEPARTAMENTO DE INFORMACION ESTRATEGIA Y VULNERABILIDAD;;
24131;DEPARTAMENTO EVALUACION SEGURIDAD EN SISTEMAS DE MEDICION DE EXPLORACION Y PRODUCCION;;
24137;DEPARTAMENTO DE EVALUACION SEGURIDAD EN SISTEMAS DE DISTRIBUCION REGION NORTE;;
24137;DEPARTAMENTO DE EVALUACION SEGURIDAD EN SISTEMAS DE DISTRIBUCION REGION OCCIDENTE;;
24140;TALLER DE SOLDADURA;;
24210;SUBGERENCIA DE OPERACIONES;;
24220;SUBGERENCIA DE SOPORTE TACTICO;;
24237;DEPARTAMENTO ZONA;;2054
24252;DEPARTAMENTO ZONA;;224
24252;DEPARTAMENTO ZONA CIMA DEL TOGO;;470
24262;DEPARTAMENTO ZONA;;2225
24267;DEPARTAMENTO ZONA VILLAHERMOSA ;;1972
24310;TALLER ELECTRICO;;
24321;DEPARTAMENTO DE CALIDAD;;
24322;DEPARTAMENTO DE PROYECTOS DE SALVAGUARDIA;;
24500;OPERACION DE EXPLORACION;;
24530;TALLER DE PATIO Y MANIOBRAS;;
25010;UNIDAD DE SEGURIDAD Y PROTECCION CIVIL;;
25061;DEPARTAMENTO DE ADMINISTRACION PATRIMONIAL;;432
25061;DEPARTAMENTO DE ADMINISTRACION PATRIMONIAL;;2138
25120;SUBGERENCIA DE GESTION Y CENTROL A LOS PROCESOS;;
25130;DISEÑO DE EXPLOTACION ORIENTAL;;
25130;SUBGERENCIA ARCHIVISTICA Y DE GESTION DE DOCUMENTACION;;
25200;DEPARTAMENTO DE SEGURIDAD INDUSTRIAL Y PROTECCION AMBIENTAL;;
25220;ANALISIS Y CONTROL OPERATIVO DE INSTALACION;;
25240;MANTENIMIENTO DE EQUIPO DE COMPRESION;;
25240;SUBGERENCIA DE APROVECHAMIENTO INMOBILIARIO;;
25400;SISTEMAS DE COMPRESION Y SERVICIOS AUXILIARES;;
25411;REPRESENTACION ADUANAL;;2283
25421;RECURSOS MATERIALES;;2123
25431;RECURSOS FINANCIEROS ;;2123
25512;DEPARTAMENTO DE CONSERVACION Y MANTENIMIENTO;;233
25613;AREA DE CONSERVACION Y MANTENIMIENTO;;2123
25620;OPERACION DE POZOS E INSTALACIONES;;
25630;MANTENIMIENTO DE EQUIPO DINAMICO E INSTRUMENTOS;;
26000;DEPARTAMENTO DE EVALUACION Y MEJORA;;
26100;GRUPO MULTIDISCIPLINARIO DE MANTENIMIENTO Y LOGISTICA REGION NORTE;;
26120;PLANTA RECUPERADORA DE AZUFRE;;
26200;DEPARTAMENTO DE ADMINISTRACION DE PROYECTOS E INNOVACION;;
26300;DEPARTAMENTO DE PLANEACION DE OPERACIONES Y MEDICION;;
26320;DEPARTAMENTO DE ALMACEN;;
26400;DEPARTAMENTO DE DESARROLLO Y ENTRENAMIENTO;;
27000;COORDINACION ADMINISTRATIVA;;
27100;GRUPO MULTIDISCIPLINARIO DE MANTENIMIENTO Y LOGISTICA REGION SUR;;
27113;SUBGERENCIA DE INTEGRACION Y EVALUACION DEL MODELO OPERATIVO;;
27200;DEPARTAMENTO DE ADQUISICIONES Y ALMACENES;;
27200;DEPARTAMENTO DE CONTROL QUIMICO;;
27231;SUBGERENCIA DE SOLUCIONES PARA SISTEMAS OPERACION;;
27314;SUBGERENCIA DE GESTION Y EVALUACION DE SERVICIOS DE INFRAESTRUCTURA;;
27331;SUBGERENCIA DE TRANSPORTE BASICO;;
27333;SUBGERENCIA DE REDES CONVERGENTES;;
27334;SUBGERENCIA DE GESTION DE INFRAESTRUCTURA DE TELECOMUNICACIONES;;
27341;SUBGERENCIA DE EQUIPO DE COMPUTO MEJORA Y SERVICIOS;;
27363;DEPARTAMENTO DE INFRAESTRUCTURA Y TELECOMUNICACIONES ZONA SUR;;
27400;DEPARTAMENTO DE CONTABILIDAD;;
28000;CENTRO DEL SECTOR OPERATIVO MUSPAC;;172
28000;CENTRO DEL SECTOR OPERATIVO SAMARIA LUNA;;1974
28010;DEPARTAMENTO DE TECNOLOGIA Y CONFIABILIDAD;;
28030;DEPARTAMENTO DE MANTENIMIENTO PLANTAS Y MANIOBRAS;;
28040;DEPARTAMENTO DE MANTENIMIENTO MECANICO;;
28041;TALLER MECANICO;;
28042;TALLER DE MAQUINAS Y HERRAMIENTAS;;
28050;DEPARTAMENTO DE MANTENIMIENTO DE INSTRUMENTOS;;
28070;DEPARTAMENTO DE MANTENIMIENTO CIVIL;;
28080;DEPARTAMENTO DE ENTRENADORES DE TALLERES;;
28600;EVALUACION Y LOGISTICA;;
28900;MANTENIMIENTO Y LOGISTICA SECTOR OPERATIVO;;172
28900;MANTENIMIENTO Y LOGISTICA SECTOR OPERATIVO;;2048
28900;MANTENIMIENTO Y LOGISTICA SECTOR OPERATIVO BURGOS;;2077
28900;MANTENIMIENTO Y LOGISTICA SECTOR OPERATIVO;;2095
28905;RECONSTRUCCION DE EQUIPO DINAMICO CATALITICO;;
29100;DEPARTAMENTO LINEA DE NEGOCIO DE PROCESOS DE ENDULZAMIENTO Y RECUPERACION DE AZUFRE;;
29100;"UNIDAD DE NEGOCIOS 1; ENDULZAMIENTO DE GAS RECUPERACION DE AZUFRE CR FR M PR IN Y QM";;
29100;"UNIDAD DE NEGOCIOS; ENDULZAMIENTO DE GAS Y RECUPERACION DE AZUFRE CRIOGENICAS E IN";;
29101;PLANTA ENDULZADORA DE GAS 1;;
29110;"UNIDAD DE NEGOCIOS 1; AB DESARROLLO PRIMARIO MONITOREO DE PRODUCCION E INYECCION";;
29123;PLANTA ENDULZADORA DE CONDENSADOS;;
29140;U N 3-END COND 1Y2 TRAT EFLU QUEM Y SEP;;
29200;"DEPARTAMENTO DE LINEA DE NEGOCIOS PROCESO; SERVICIO AUXILIARES";;
29200;"UNIDAD DE NEGOCIOS 2; SERVICIOS AUXILIARES TRATAMIENTO DE EFLUENTES Y BOCATOMA";;
29201;LICUADOS I Y II;;
29210;"UNIDAD DE NEGOCIOS 2; CRIOGENICAS 1 Y 2 Y AREA DE C";;
29210;"UNIDAD DE NEGOCIOS 3; SERVICIOS AUXILIARES AGUAS NEGRAS Y QUEMADORES INTEGRACION Y MANEJO DE PRODUCTO Y LLENADO";;
29220;"UNIDAD DE NEGOCIOS 4; CRIOGENICAS 1 Y CRIOGENICAS MODULARES 4 5 Y 6";;
29230;"UNIDAD DE NEGOCIOS 5; FRACCIONAMIENTO DE HIDROCARBUROS MOVILIDAD PRODUCCION E INTEGRAL";;
29300;DEPARTAMENTO DE SOPORTE A LA PRODUCCION;;
29303;EFLUENTES QUEMADORES Y SEPARADORES;;
29310;"UNIDAD DE NEGOCIOS 3; SERVICIOS AUXILIARES EFLUENTES Y TRATAMIENTO DE AGUAS NEGRAS";;
